{
  "$schema": "https://ironcannon.dev/schemas/rule-fragment/v1",
  "id": "layer4/obligation/leg-record-002",
  "layer": 4,
  "rulesetVersion": "2026.05.31",
  "flowId": "auth-lifecycle",
  "section": "leg-record-002",
  "content": {
    "requirement": "Unsubscribe request audit trail",
    "obligations": [
      "LEG-RECORD-002"
    ],
    "compareSteps": [
      "Run detect.type=schema_table per COMPARE_DETECT_TYPES",
      "Map result to obligation LEG-RECORD-002 only",
      "Attach legalDisclaimer on every T12–T14 response"
    ],
    "remediationDirective": "Remediate LEG-RECORD-002: Unsubscribe request audit trail"
  },
  "references": [
    "legal/can-spam-unsubscribe"
  ],
  "compliancePatterns": {
    "required": [
      {
        "id": "LEG-RECORD-002",
        "type": "schema_table",
        "tier": "ironclad"
      }
    ]
  },
  "metadata": {
    "minTier": "ironclad",
    "category": "records",
    "disclaimerRequired": true
  }
}
